Sheet: sygeco1
B1: Designator | C1: Package | D1: Quantity | E1: Designation | F1: Supplier and ref | G1: Unit price | H1: price
B2: S1 | C2: SKQUCAA010 | D2: 1 | E2: 5-way-joystick-switch | F2: aliexpress | G2: 0.4 | H2: of:=[.G2]*[.D2] -> 0.4
B3: PCB | D3: 1 | F3: jlcpcb | G3: 0.4 | H3: of:=[.G3]*[.D3] -> 0.4
B4: BT1 | C4: BatteryHolder_China_1x20mm | D4: 1 | E4: Battery_Cell | F4: aliexpress | G4: 0.15 | H4: of:=[.G4]*[.D4] -> 0.15
B5: LS1 | C5: MagneticBuzzer_ProSignal_ABT-410-RC | D5: 1 | E5: Speaker | F5: aliexpress | G5: 0.15 | H5: of:=[.G5]*[.D5] -> 0.15
B6: U1 | C6: DIP-8_W7.62mm_Socket_LongPads | D6: 1 | E6: ATtiny85-20PU | F6: aliexpress | G6: 0.07 | H6: of:=[.G6]*[.D6] -> 0.07 | J6: round-shape : 0.1
B7: SW1,SW2 | C7: DPDT_Switch_with_lock | D7: 2 | E7: SW_Push_DPDT | F7: aliexpress | G7: 0.05 | H7: of:=[.G7]*[.D7] -> 0.1
D8: 2 | E8: button cap for lock-switch | F8: aliexpress | G8: 0.04 | H8: of:=[.G8]*[.D8] -> 0.08
B9: REF** | C9: PinHeader_1x04_P2.54mm_Vertical | D9: 1 | E9: PinHeader_1x04_P2.54mm_Vertical | F9: aliexpress | G9: 0.03 | H9: of:=[.G9]*[.D9] -> 0.03
B10: C1 | C10: C_1206_3216Metric_Pad1.33x1.80mm_HandSolder | D10: 1 | E10: 0.1 uF | F10: aliexpress | G10: 0.03 | H10: of:=[.G10]*[.D10] -> 0.03
B11: bag | D11: 1 | E11: plastic bag | F11: aliexpress | G11: 0.03 | H11: of:=[.G11]*[.D11] -> 0.03
D12: 1 | E12: button cap for joystick | G12: 0.03 | H12: of:=[.G12]*[.D12] -> 0.03
B13: D1 | C13: LED_1206_3216Metric | D13: 1 | E13: LED | F13: aliexpress | G13: 0.02 | H13: of:=[.G13]*[.D13] -> 0.02
B14: J2 | C14: PinHeader_2x03_P2.54mm_Vertical | D14: 1 | E14: AVR-ISP-6 | F14: aliexpress | G14: 0.02 | H14: of:=[.G14]*[.D14] -> 0.02
B15: R6 | C15: R_1206_3216Metric | D15: 1 | E15: 15 | F15: aliexpress | G15: 0.01 | H15: of:=[.G15]*[.D15] -> 0.01
B16: R1,R2,R3,R4,R5 | C16: R_1206_3216Metric_Pad1.30x1.75mm_HandSolder | D16: 5 | E16: 50k | F16: aliexpress | G16: 0.01 | H16: of:=[.G16]*[.D16] -> 0.05
H17: of:=SUM([.H2:.H16]) -> 1.57 | I17: Light version
B18: 1306 screen | D18: 1 | G18: 2 | H18: of:=[.G18]*[.D18] -> 2
B19: MCU | D19: 1 | E19: attiny85 | F19: farnell | G19: 1 | H19: of:=[.G19]*[.D19] -> 1
B20: CR2032 | D20: 1 | E20: cell battery | G20: 0.2 | H20: of:=[.G20]*[.D20] -> 0.2
H21: of:=[.H17]+[.H18]+[.H19]+[.H20] -> 4.77 | I21: Full version